{
  "fieldValues" : [
    {
      "value" : "undefined" ,
      "id" : "undefined"
    }
  ] ,
  "address1" : "1921 Gallows Road" ,
  "address2" : "" ,
  "address3" : "" ,
  "city" : "undefined" ,
  "province" : "undefined" ,
  "postalCode" : "undefined" ,
  "country" : "USA" ,
  "businessPhone" : "undefined" ,
  "name" : "undefined" ,
  "description" : "Eloqua" ,
  "permissions" : "undefined" ,
  "folderId" : "undefined" ,
  "sourceTemplateId" : "undefined" ,
  "createdBy" : "undefined" ,
  "createdAt" : "undefined" ,
  "updatedBy" : "undefined" ,
  "updatedAt" : "undefined" ,
  "accessedAt" : "undefined" ,
  "scheduledFor" : "undefined" ,
  "depth" : "minimal"
}